{
  "actor": "upgrade-fixture",
  "command": "review",
  "contract_version": "1.0.0",
  "created_at": "2026-09-22T12:00:00Z",
  "id": "review-legacy",
  "payload": {
    "artifact_id": "artifact-fixture",
    "blocking_findings": [],
    "dimensions": {
      "brand_integrity": "UNVERIFIED",
      "consequence": "UNVERIFIED",
      "craft": "UNVERIFIED",
      "defensibility": "UNVERIFIED",
      "distinctiveness": "UNVERIFIED",
      "format_fidelity": "UNVERIFIED",
      "insight": "UNVERIFIED",
      "strategic_purpose": "UNVERIFIED"
    },
    "provenance": [
      {
        "kind": "fixture",
        "source": "fixtures/core.json"
      }
    ],
    "reviewer_id": "fixture-reviewer",
    "rubric_version": "publishing-house-quality-rubric-v1",
    "schema_version": "1.0.0",
    "verdict": "unverified"
  },
  "provenance": [
    {
      "kind": "fixture",
      "source": "fixtures/core.json"
    }
  ],
  "record_type": "review",
  "schema_version": "1.0.0",
  "tool_version": "0.2.0"
}
